{
  "schema_version": "personal-acceptance-baseline/v2",
  "batch": "n09-independent-review-20260914",
  "recorded_at": "2026-09-14T02:08:32.460348+00:00",
  "legs": [
    {
      "leg_id": "L1",
      "binary_sha256": "fe03e7e0047f2e54db8a9ad0f4198312774e8a43255194b56495df4c47a23ea5",
      "started_at": "2026-09-13T23:32:47.726372+00:00",
      "finished_at": "2026-09-13T23:33:07.836788+00:00",
      "report_ref": "docs/evidence/personal-experience/n09a-linux-baseline-20260914-072756/leg-L1-result.json",
      "report_sha256": "7d96f9af7e27ac8ec8d47d6f52f2cf30dee7fa27fed17ab21d0f719b470f893d",
      "checks_passed": 14,
      "platform": "hermes",
      "os": "linux"
    },
    {
      "leg_id": "L2",
      "binary_sha256": "fe03e7e0047f2e54db8a9ad0f4198312774e8a43255194b56495df4c47a23ea5",
      "started_at": "2026-09-13T23:33:07.837302+00:00",
      "finished_at": "2026-09-13T23:33:18.377403+00:00",
      "report_ref": "docs/evidence/personal-experience/n09a-linux-baseline-20260914-072756/leg-L2-report.json",
      "report_sha256": "c572b8bebf9cfad1b37cab47db54200d9636cd14b8eef17ef1f6a4a52e92f583",
      "checks_passed": 12,
      "platform": "hermes",
      "os": "linux"
    },
    {
      "leg_id": "L4",
      "binary_sha256": "fe03e7e0047f2e54db8a9ad0f4198312774e8a43255194b56495df4c47a23ea5",
      "started_at": "2026-09-13T23:33:29.970118+00:00",
      "finished_at": "2026-09-13T23:33:40.308828+00:00",
      "report_ref": "docs/evidence/personal-experience/n09a-linux-baseline-20260914-072756/leg-L4-report.json",
      "report_sha256": "63ae1b422fe8f45e261331dac945aeacf6a7b984e80bc8b81cd8f449ab811b47",
      "checks_passed": 19,
      "platform": "hermes",
      "os": "linux"
    },
    {
      "leg_id": "L5",
      "binary_sha256": "fe03e7e0047f2e54db8a9ad0f4198312774e8a43255194b56495df4c47a23ea5",
      "started_at": "2026-09-13T23:33:40.309322+00:00",
      "finished_at": "2026-09-13T23:33:44.833292+00:00",
      "report_ref": "docs/evidence/personal-experience/n09a-linux-baseline-20260914-072756/leg-L5-result.json",
      "report_sha256": "77ecdade542a44992c47fe2c8edd1c07a160d48eec009f585f4d92d7d8d73da4",
      "checks_passed": 7,
      "platform": "hermes",
      "os": "linux"
    },
    {
      "leg_id": "L6",
      "binary_sha256": "fe03e7e0047f2e54db8a9ad0f4198312774e8a43255194b56495df4c47a23ea5",
      "started_at": "2026-09-13T23:33:44.833739+00:00",
      "finished_at": "2026-09-13T23:33:55.824659+00:00",
      "report_ref": "docs/evidence/personal-experience/n09a-linux-baseline-20260914-072756/leg-L6-report.json",
      "report_sha256": "6e90e023748fe5a055465960d05ce2031b2320413f31979f5f7f62cbbe45de90",
      "checks_passed": 13,
      "platform": "hermes",
      "os": "linux"
    },
    {
      "leg_id": "N09B",
      "binary_sha256": "fe03e7e0047f2e54db8a9ad0f4198312774e8a43255194b56495df4c47a23ea5",
      "started_at": "2026-09-14T01:05:46Z",
      "finished_at": "2026-09-14T01:06:16Z",
      "report_ref": "docs/evidence/personal-experience/n09b-openclaw-runtime-20260914-090546/leg-report.json",
      "report_sha256": "1f9eb92eb6a463a427830de12af3b2017db4fcc40504296301ea3677a2066192",
      "checks_passed": 11,
      "platform": "openclaw",
      "os": "linux"
    }
  ],
  "cells": [
    {
      "platform": "hermes",
      "os": "linux",
      "rows": [
        {
          "item": "J1",
          "status": "unverified",
          "classification": "component_integration",
          "evidence_refs": [
            "docs/evidence/personal-experience/n09a-linux-baseline-20260914-072756/leg-L1-result.json"
          ],
          "coverage": [
            {
              "leg_id": "L1",
              "checks": [
                "first_onboarding_completed_via_ui"
              ]
            }
          ],
          "note": "Partial observations only; original green leg result does not close this journey row.",
          "required_evidence": "Product package installation, service start and management UI on a clean native environment."
        },
        {
          "item": "J2",
          "status": "unverified",
          "classification": "component_integration",
          "evidence_refs": [
            "docs/evidence/personal-experience/n09a-linux-baseline-20260914-072756/leg-L1-result.json"
          ],
          "coverage": [
            {
              "leg_id": "L1",
              "checks": [
                "discovery_finds_fixture_skill_without_touching_config"
              ]
            }
          ],
          "note": "Partial observations only; original green leg result does not close this journey row.",
          "required_evidence": "Complete agent and Skill discovery, including existing installations and nondefault roots."
        },
        {
          "item": "J3",
          "status": "controlled_start",
          "classification": "native_machine",
          "evidence_refs": [
            "docs/evidence/personal-experience/n09a-linux-baseline-20260914-072756/leg-L1-result.json",
            "docs/evidence/personal-experience/n09a-linux-baseline-20260914-072756/leg-L6-report.json"
          ],
          "coverage": [
            {
              "leg_id": "L1",
              "checks": [
                "first_onboarding_completed_via_ui"
              ]
            },
            {
              "leg_id": "L6",
              "checks": [
                "managed_install_uses_issued_identity",
                "native_enable_preserves_user_settings"
              ]
            }
          ],
          "note": "Historical native observation for this portion of the journey; not complete acceptance of the final candidate."
        },
        {
          "item": "J4",
          "status": "unverified",
          "classification": "component_integration",
          "evidence_refs": [
            "docs/evidence/personal-experience/n09a-linux-baseline-20260914-072756/leg-L1-result.json",
            "docs/evidence/personal-experience/n09a-linux-baseline-20260914-072756/leg-L4-report.json"
          ],
          "coverage": [
            {
              "leg_id": "L1",
              "checks": [
                "allow_decided_in_console",
                "deny_decided_in_console",
                "denied_retry_stays_blocked_without_file"
              ]
            },
            {
              "leg_id": "L4",
              "checks": [
                "allowed_read",
                "write_denied_before_execution",
                "allowed_after_denial"
              ]
            }
          ],
          "note": "Partial observations only; original green leg result does not close this journey row.",
          "required_evidence": "Native permission allow/deny matrix for the final candidate, beyond one fixture read/write."
        },
        {
          "item": "J5",
          "status": "unverified",
          "classification": "component_integration",
          "evidence_refs": [
            "docs/evidence/personal-experience/n09a-linux-baseline-20260914-072756/leg-L2-report.json"
          ],
          "coverage": [
            {
              "leg_id": "L2",
              "checks": [
                "grant_require_approval_applied",
                "native_cli_runs_completed",
                "hold_degrades_to_block_without_execution",
                "block_message_points_to_console",
                "console_approval_recorded",
                "approved_retry_consumed_hold_and_executed_once",
                "hold_status_reports_consumed_after_retry",
                "no_new_pending_confirmation_after_consumption",
                "single_execution_observation_on_consumption_receipt",
                "retry_after_consumption_reholds_and_denial_blocks",
                "unresolved_retry_never_executes",
                "receipt_chain_verified"
              ]
            }
          ],
          "note": "Partial observations only; original green leg result does not close this journey row.",
          "required_evidence": "Native approved retry and observed exactly-once side effects, notification/failure/replay cases."
        },
        {
          "item": "J6",
          "status": "unverified",
          "classification": "component_integration",
          "evidence_refs": [
            "docs/evidence/personal-experience/n09a-linux-baseline-20260914-072756/leg-L4-report.json",
            "docs/evidence/personal-experience/n09a-linux-baseline-20260914-072756/leg-L5-result.json"
          ],
          "coverage": [
            {
              "leg_id": "L4",
              "checks": [
                "managed_preview_does_not_mutate_host",
                "managed_install_uses_issued_identity",
                "native_enable_preserves_other_profile_and_settings",
                "diagnosis_keeps_runtime_unverified",
                "managed_profile_product_selfcheck_uses_separate_authority",
                "native_cli_started",
                "native_generated_session_automatically_bound",
                "instance_credential_used_without_manual_intent",
                "environment_cannot_override_managed_agent",
                "allowed_read",
                "write_denied_before_execution",
                "allowed_after_denial",
                "native_raw_parameters_captured_after_explicit_task_grant",
                "native_raw_output_captured_after_explicit_task_grant",
                "receipt_chain_verified",
                "skill_removal_blocks_still_issued_identity_in_new_native_session",
                "revoked_calls_record_unsigned_denials",
                "product_skill_import_approval_installation",
                "installed_content_bound_instance_permission"
              ]
            },
            {
              "leg_id": "L5",
              "checks": [
                "unapproved_candidate_is_review_only_with_content_and_permission_diff",
                "prepared_refresh_is_read_only_and_requires_review_again",